[
  {
    "id": "kamisato-ayaka",
    "name": "Kamisato Ayaka",
    "element": "Cryo",
    "weaponType": "Sword",
    "rarity": 5,
    "nationInGame": "Inazuma",
    "releaseDate": "2021-07-20",
    "baseStats": {
      "lv1": {
        "hp": 1001,
        "atk": 27,
        "def": 61
      },
      "lv90": {
        "hp": 12858,
        "atk": 342,
        "def": 784,
        "ascensionStatType": "CRIT DMG",
        "ascensionStatValue": 0.384
      }
    },
    "normalAttack": {
      "name": "Kamisato Art: Kabuki",
      "hits": [
        {
          "label": "1-Hit",
          "values": {
            "lv1": "45.7%",
            "lv10": "90.4%"
          }
        },
        {
          "label": "2-Hit",
          "values": {
            "lv1": "48.7%",
            "lv10": "96.2%"
          }
        },
        {
          "label": "3-Hit",
          "values": {
            "lv1": "62.6%",
            "lv10": "123.8%"
          }
        },
        {
          "label": "4-Hit (×3)",
          "values": {
            "lv1": "22.6%",
            "lv10": "44.8%"
          }
        },
        {
          "label": "5-Hit",
          "values": {
            "lv1": "78.2%",
            "lv10": "154.5%"
          }
        },
        {
          "label": "Đòn nặng (×3)",
          "values": {
            "lv1": "55.1%",
            "lv10": "109.0%"
          }
        },
        {
          "label": "Sát thương nhảy thấp/cao",
          "values": {
            "lv1": "127.8%/159.7%",
            "lv10": "252.7%/315.6%"
          }
        }
      ]
    },
    "elementalSkill": {
      "name": "Kamisato Art: Hyouka",
      "description": "Triệu hồi băng nở rộ, hất tung địch quanh Ayaka và gây sát thương AoE Cryo. Cấp kỹ năng được C5 tăng thêm 3.",
      "scaling": [
        {
          "label": "Sát thương kỹ năng",
          "values": {
            "lv1": "239.2%",
            "lv10": "430.6%",
            "lv13": "568.1%"
          }
        }
      ],
      "cooldown": "10s",
      "energyCost": 0
    },
    "elementalBurst": {
      "name": "Kamisato Art: Soumetsu",
      "description": "Triệu hồi bão tuyết Frostflake Seki no To lướt về phía trước, liên tục chém gây Cryo DMG rồi nổ tung gây AoE Cryo DMG cuối màn. Cấp kỹ năng được C3 tăng thêm 3.",
      "scaling": [
        {
          "label": "Sát thương chém",
          "values": {
            "lv1": "112.3%",
            "lv10": "202.1%",
            "lv13": "266.7%"
          }
        },
        {
          "label": "Sát thương nổ",
          "values": {
            "lv1": "168.5%",
            "lv10": "303.2%",
            "lv13": "400.1%"
          }
        },
        {
          "label": "Thời lượng",
          "values": {
            "lv1": "5.0s",
            "lv10": "5.0s",
            "lv13": "5.0s"
          }
        }
      ],
      "cooldown": "20s",
      "energyCost": 80
    },
    "additionalTalents": [
      {
        "name": "Kamisato Art: Senho",
        "description": "Đòn giữ/né đặc biệt (cấp cố định 1): tiêu Thể lực để lướt trên mặt nước trong màn sương lạnh; khi thoát trạng thái, gây Cryo diện rộng quanh Ayaka và tráng Cryo lên đòn đánh trong thời gian ngắn. Tiêu 10 Thể lực để kích hoạt, hao 15 Thể lực/giây, thời gian tráng nguyên tố 5s.",
        "scaling": [],
        "cooldown": null,
        "energyCost": null
      }
    ],
    "passives": [
      {
        "name": "Amatsumi Kunitsumi Sanctification",
        "unlock": "A1",
        "description": "Sau khi dùng Hyouka, đòn thường/nặng của Ayaka tăng 30% sát thương trong 6s."
      },
      {
        "name": "Kanten Senmyou Blessing",
        "unlock": "A4",
        "description": "Khi Cryo cuối đòn Senho trúng địch, Ayaka hồi 10 Thể lực và nhận 18% Cryo DMG Bonus trong 10s."
      },
      {
        "name": "Fruits of Shinsa",
        "unlock": "Utility",
        "description": "10% cơ hội nhân đôi nguyên liệu đột phá vũ khí khi chế tạo."
      }
    ],
    "constellations": [
      {
        "level": 1,
        "name": "Snowswept Sakura",
        "description": "Đòn thường/nặng gây Cryo DMG có 50% cơ hội giảm CD Hyouka 0.3s (tối đa 1 lần/0.1s)."
      },
      {
        "level": 2,
        "name": "Blizzard Blade Seki no To",
        "description": "Khi dùng Soumetsu, tung thêm 2 Frostflake Seki no To nhỏ, mỗi cái gây 20% sát thương bão gốc."
      },
      {
        "level": 3,
        "name": "Frostbloom Kamifubuki",
        "description": "Tăng cấp Soumetsu thêm 3 (tối đa cấp 15 theo hệ thống, thực tế đạt 13)."
      },
      {
        "level": 4,
        "name": "Ebb and Flow",
        "description": "Địch trúng Frostflake Seki no To của Soumetsu giảm 30% DEF trong 6s."
      },
      {
        "level": 5,
        "name": "Blossom Cloud Irutsuki",
        "description": "Tăng cấp Hyouka thêm 3 (thực tế đạt 13)."
      },
      {
        "level": 6,
        "name": "Dance of Suigetsu",
        "description": "Cứ 10s Ayaka nhận Usurahi Butou, tăng 298% sát thương đòn nặng; hiệu ứng biến mất 0.5s sau khi đòn nặng trúng địch rồi khởi động lại đếm giờ."
      }
    ],
    "abyssRoleNotes": "DPS chính Cryo on-field dựa vào Hyouka + Soumetsu để đóng băng diện rộng. Combo phổ biến: Đóng băng (Cryo-Hydu) với Kokomi/Yelan, hoặc Tan chảy (Cryo-Pyro) với Xiangling/Bennett làm phụ trợ.",
    "sourceFile": "nhan-vat/inazuma-fontaine.md"
  },
  {
    "id": "yoimiya",
    "name": "Yoimiya",
    "element": "Pyro",
    "weaponType": "Bow",
    "rarity": 5,
    "nationInGame": "Inazuma",
    "releaseDate": "2021-08-10",
    "baseStats": {
      "lv1": {
        "hp": 791,
        "atk": 25,
        "def": 48
      },
      "lv90": {
        "hp": 10164,
        "atk": 323,
        "def": 615,
        "ascensionStatType": "CRIT Rate",
        "ascensionStatValue": 0.192
      }
    },
    "normalAttack": {
      "name": "Firework Flare-Up",
      "hits": [
        {
          "label": "1-Hit (×2)",
          "values": {
            "lv1": "35.6%",
            "lv10": "63.6%"
          }
        },
        {
          "label": "2-Hit",
          "values": {
            "lv1": "68.4%",
            "lv10": "122.0%"
          }
        },
        {
          "label": "3-Hit",
          "values": {
            "lv1": "88.9%",
            "lv10": "158.6%"
          }
        },
        {
          "label": "4-Hit (×2)",
          "values": {
            "lv1": "46.4%",
            "lv10": "82.8%"
          }
        },
        {
          "label": "5-Hit",
          "values": {
            "lv1": "105.9%",
            "lv10": "188.9%"
          }
        },
        {
          "label": "Aimed Shot",
          "values": {
            "lv1": "43.9%",
            "lv10": "86.7%"
          }
        },
        {
          "label": "Aimed Shot sạc đầy",
          "values": {
            "lv1": "124.0%",
            "lv10": "223.2%"
          }
        },
        {
          "label": "Kindling Arrow",
          "values": {
            "lv1": "16.4%",
            "lv10": "29.5%"
          }
        }
      ]
    },
    "elementalSkill": {
      "name": "Niwabi Fire-Dance",
      "description": "Tạo vòng pháo hoa quanh Yoimiya, đòn thường trong thời gian này biến thành Blazing Arrow, gây Pyro DMG tăng thêm. Cấp kỹ năng được C3 tăng thêm 3.",
      "scaling": [
        {
          "label": "Blazing Arrow DMG (% ST đòn thường)",
          "values": {
            "lv1": "137.9%",
            "lv10": "161.7%",
            "lv13": "176.5%"
          }
        },
        {
          "label": "Thời lượng",
          "values": {
            "lv1": "10.0s",
            "lv10": "10.0s",
            "lv13": "10.0s"
          }
        }
      ],
      "cooldown": "18s",
      "energyCost": null
    },
    "elementalBurst": {
      "name": "Ryuukin Saxifrage",
      "description": "Nhảy lên bắn tên lửa gây AoE Pyro DMG, đánh dấu Aurous Blaze lên 1 địch — đồng đội (trừ Yoimiya) đánh trúng địch đánh dấu sẽ kích nổ gây thêm AoE Pyro DMG. Cấp kỹ năng được C5 tăng thêm 3.",
      "scaling": [
        {
          "label": "Sát thương kỹ năng",
          "values": {
            "lv1": "127.2%",
            "lv10": "229.0%",
            "lv13": "302.1%"
          }
        },
        {
          "label": "Sát thương nổ Aurous Blaze",
          "values": {
            "lv1": "122.0%",
            "lv10": "219.6%",
            "lv13": "289.8%"
          }
        }
      ],
      "cooldown": "15s",
      "energyCost": 60
    },
    "additionalTalents": [],
    "passives": [
      {
        "name": "Tricks of the Trouble-Maker",
        "unlock": "A1",
        "description": "Trong Niwabi Fire-Dance, mỗi phát đòn thường trúng địch tăng 2% Pyro DMG Bonus (tối đa 10 lớp, 3s/lớp)."
      },
      {
        "name": "Summer Night's Dawn",
        "unlock": "A4",
        "description": "Dùng Ryuukin Saxifrage cho đồng đội (trừ Yoimiya) +10% ATK trong 15s, cộng thêm 1%/lớp Trouble-Maker đang có."
      },
      {
        "name": "Blazing Match",
        "unlock": "Utility",
        "description": "100% hoàn trả một phần nguyên liệu khi chế tạo đồ nội thất loại Trang trí/Vật phẩm/Cảnh quan."
      }
    ],
    "constellations": [
      {
        "level": 1,
        "name": "Agate Ryuukin",
        "description": "Aurous Blaze kéo dài thêm 4s; hạ gục địch trong thời gian này giúp Yoimiya +20% ATK trong 20s."
      },
      {
        "level": 2,
        "name": "A Procession of Bonfires",
        "description": "Pyro DMG chí mạng cho Yoimiya +25% Pyro DMG Bonus trong 6s (kích hoạt cả khi không ở tiền tuyến)."
      },
      {
        "level": 3,
        "name": "Trickster's Flare",
        "description": "Tăng cấp Niwabi Fire-Dance thêm 3 (thực tế 13)."
      },
      {
        "level": 4,
        "name": "Pyrotechnic Professional",
        "description": "Aurous Blaze tự nổ giảm CD Niwabi Fire-Dance 1.2s."
      },
      {
        "level": 5,
        "name": "A Summer Festival's Eve",